{"schema": "houseatlas.ifc-semantic-map.v2", "semanticMapRevisionId": "453cf63c-67a3-5abb-9cf3-ea19b0726538", "previousSemanticMapRevisionId": null, "sourceRevisionId": "e6987fc9-4f98-59e2-a9da-ea5849ca687a", "ifcOriginalSha256": "fdb561137f395460d78ff43b0b9f0e034932f42656396caf88095a514690c768", "workspaceId": "eda986dc-80fc-584c-9350-ebcc4bd5d599", "homeId": "5ac4b592-ed7c-5a17-a503-0eedb2477bb1", "buildingId": "ed098a05-48ae-5253-a1b8-214d4b82c8d6", "floors": [{"floorId": "2ff038c0-2e81-5cbe-95d4-59d3df81245a", "ifcBuildingStoreyGlobalId": "3123456789ABCDEFGHIJKL", "atlasPlaceId": null, "displayName": "Synthetic floor"}, {"floorId": "ed6121fa-55c6-5ee1-9990-1285dccbc6af", "ifcBuildingStoreyGlobalId": "3123456789ABCDEFGHIJKN", "atlasPlaceId": null, "displayName": "Second floor"}], "rooms": [{"roomId": "27c1c078-4ea7-56a5-9ca3-00bb5a210f22", "atlasPlaceId": null, "packagePlace": null, "displayName": "Synthetic combined room", "occurrences": [{"spaceOccurrenceId": "synthetic-space-one", "ifcSpaceGlobalId": "0123456789ABCDEFGHIJKL", "floorId": "2ff038c0-2e81-5cbe-95d4-59d3df81245a"}, {"spaceOccurrenceId": "synthetic-space-two", "ifcSpaceGlobalId": "0123456789ABCDEFGHIJKM", "floorId": "ed6121fa-55c6-5ee1-9990-1285dccbc6af"}]}], "electricalGroups": [], "transitions": []}